{
  "window_id": "maintenance_window_env_123_weekly",
  "organization_id": "org_123",
  "project_id": "project_123",
  "environment_id": "env_123",
  "name": "Weekly maintenance",
  "day_of_week": "sunday",
  "start_time": "03:00",
  "duration_minutes": 120,
  "auto_minor_upgrades": true,
  "status": "active"
}
